{
  "object_kind": "merge_request",
  "event_type": "merge_request",
  "project": { "id": 1, "name": "demo", "path_with_namespace": "acme/demo" },
  "object_attributes": {
    "iid": 7,
    "title": "Add feature X",
    "state": "opened",
    "action": "open",
    "source_branch": "feat/x",
    "target_branch": "main"
  },
  "user": { "username": "alice" }
}
